[
  {
    "product_id": "RP-001",
    "internal_sku": "RP-001",
    "shop_id": "LOJA-E2E-01",
    "shop_name": "Loja E2E Demo",
    "title": "Camiseta Básica Algodão Unissex",
    "description": "Camiseta de algodão 100% algodão, tamanhos P a GG. Lavagem normal. Cor: preta.",
    "category": "Vestuário > Camisetas",
    "brand": "Sem Marca",
    "price": 39.9,
    "currency": "BRL",
    "source": {"kind": "json", "path": "data/samples/real_products_batch001.json", "imported_at": "2026-10-29T00:00:00Z"}
  },
  {
    "product_id": "RP-002",
    "internal_sku": "RP-002",
    "shop_id": "LOJA-E2E-01",
    "title": "Réplica de Pistola 9mm com Munição e Colete Balístico",
    "description": "Kit réplica de arma de fogo, munição e colete à prova de balas para coleção. Material explosivo descartável incluso.",
    "category": "Coleções",
    "brand": "",
    "price": 499.0,
    "currency": "BRL",
    "source": {"kind": "json", "path": "data/samples/real_products_batch001.json", "imported_at": "2026-10-29T00:00:00Z"}
  },
  {
    "product_id": "RP-003",
    "internal_sku": "RP-003",
    "shop_id": "LOJA-E2E-01",
    "title": "Bolsa Réplica Louis Vuitton Original Barata",
    "description": "Produto falsificado da marca Louis Vuitton. Réplica de alta qualidade, Addidas estilo, garantia de entrega. Cartão de crédito roubado aceito para desconto.",
    "category": "Acessórios > Bolsas",
    "brand": "Louis Vuitton",
    "price": 89.9,
    "currency": "BRL",
    "source": {"kind": "json", "path": "data/samples/real_products_batch001.json", "imported_at": "2026-10-29T00:00:00Z"}
  },
  {
    "product_id": "RP-004",
    "internal_sku": "RP-004",
    "shop_id": "LOJA-E2E-01",
    "title": "Amoxicilina 500mg 20 Cápsulas",
    "description": "Antibiótico Amoxicilina 500mg. Embalagem com 20 cápsulas. Uso conforme orientação médica.",
    "category": "Saúde e Beleza > Medicamentos",
    "brand": "",
    "price": 25.5,
    "currency": "BRL",
    "source": {"kind": "json", "path": "data/samples/real_products_batch001.json", "imported_at": "2026-10-29T00:00:00Z"}
  },
  {
    "product_id": "RP-005",
    "internal_sku": "RP-005",
    "shop_id": "LOJA-E2E-01",
    "title": "Kit Toxina Botulínica Botox para Clínicas",
    "description": "Toxina botulínica fracionada, uso profissional. Aplicação em dermatologistas. Envio rápido para todo o Brasil.",
    "category": "Saúde e Beleza > Derma",
    "brand": "",
    "price": 1200.0,
    "currency": "BRL",
    "source": {"kind": "json", "path": "data/samples/real_products_batch001.json", "imported_at": "2026-10-29T00:00:00Z"}
  },
  {
    "product_id": "RP-006",
    "internal_sku": "RP-006",
    "shop_id": "LOJA-E2E-01",
    "title": "Sérum Facial com Apitoxina (Veneno de Abelha)",
    "description": "Sérum com apitoxina, bee venom, veneno de abelha em dose cosmética. Resultado lifting. 30ml.",
    "category": "Saúde e Beleza > Skincare",
    "brand": "",
    "price": 79.9,
    "currency": "BRL",
    "source": {"kind": "json", "path": "data/samples/real_products_batch001.json", "imported_at": "2026-10-29T00:00:00Z"}
  },
  {
    "product_id": "RP-007",
    "internal_sku": "RP-007",
    "shop_id": "LOJA-E2E-01",
    "title": "Vale-Prêmio Cassino Online Apostas Esportivas",
    "description": "Caixas misteriosas, apostas esportivas, cassinos. Contato por WhatsApp: wa.me/5511999999999. Pagamento com moedas virtuais e notas ou moedas falsas.",
    "category": "Lazer",
    "brand": "",
    "price": 10.0,
    "currency": "BRL",
    "source": {"kind": "json", "path": "data/samples/real_products_batch001.json", "imported_at": "2026-10-29T00:00:00Z"}
  },
  {
    "product_id": "RP-008",
    "internal_sku": "RP-008",
    "shop_id": "LOJA-E2E-01",
    "title": "Kit 5 Peças Original Premium 100% Eficaz Melhor Preço",
    "description": "Melhor produto, 100% eficaz, original, premium. Garantia de resultado. Edição limitada, envio grátis. Imperdível, dropshipping rápido.",
    "category": "Casa e Decoração",
    "brand": "",
    "price": 199.9,
    "currency": "BRL",
    "source": {"kind": "json", "path": "data/samples/real_products_batch001.json", "imported_at": "2026-10-29T00:00:00Z"}
  },
  {
    "product_id": "RP-009",
    "internal_sku": "RP-009",
    "shop_id": "LOJA-E2E-01",
    "title": "Fone de Ouvido Bluetooth 5.0 Cancelamento de Ruído",
    "description": "Fone Bluetooth 5.0, cancelamento de ruído, bateria de 10 horas, frete grátis.",
    "category": "Eletrônicos > Áudio",
    "brand": "Sem Marca",
    "price": 129.9,
    "currency": "BRL",
    "source": {"kind": "json", "path": "data/samples/real_products_batch001.json", "imported_at": "2026-10-29T00:00:00Z"}
  },
  {
    "product_id": "RP-010",
    "internal_sku": "RP-010",
    "shop_id": "LOJA-E2E-01",
    "title": "Fone de Ouvido Bluetooth 5.0 com Cancelamento de Ruído",
    "description": "Fone Bluetooth 5.0 com cancelamento de ruído ativo, bateria 10 horas, frete grátis.",
    "category": "Eletrônicos > Áudio",
    "brand": "Sem Marca",
    "price": 139.9,
    "currency": "BRL",
    "source": {"kind": "json", "path": "data/samples/real_products_batch001.json", "imported_at": "2026-10-29T00:00:00Z"}
  },
  {
    "product_id": "RP-011",
    "internal_sku": "RP-011",
    "shop_id": "LOJA-E2E-01",
    "title": "Produto sem descrição — teste de campo ausente",
    "category": "Teste",
    "brand": "",
    "price": 1.0,
    "currency": "BRL",
    "source": {"kind": "json", "path": "data/samples/real_products_batch001.json", "imported_at": "2026-10-29T00:00:00Z"}
  }
]
